{
  "$schema": "http://json-schema.org/draft-04/schema#",
  "description": "Bible data for a specific language",
  "type": "object",
  "properties": {
    "books": {
      "description": "The list of Bible books available in this language",
      "type": "array",
      "minItems": 1,
      "items": {
        "type": "object",
        "properties": {
          "id": {
            "description": "The ID used by YouVersion to uniquely identify this book",
            "type": "string",
            "pattern": "^([a-z]{3}|[1-3][a-z]{2})$"
          },
          "name": {
            "description": "The name of this book in the respective language",
            "type": "string"
          }
        },
        "required": ["id", "name"],
        "additionalProperties": false
      }
    },
    "language": {
      "type": "object",
      "properties": {
        "id": {
          "description": "The ISO 639-3 code for this language",
          "type": "string",
          "pattern": "^[a-z]{3}(_[a-z]{2,3})?$"
        },
        "name": {
          "description": "The name of this language as written in said language",
          "type": "string"
        }
      }
    },
    "default_version": {
      "description": "The default Bible version to use for this language",
      "type": "integer",
      "minimum": 1
    },
    "versions": {
      "description": "The list of Bible versions for this language",
      "type": "array",
      "minItems": 1,
      "items": {
        "type": "object",
        "properties": {
          "full_name": {
            "description": "The full, unabbreviated name of this version",
            "type": "string"
          },
          "id": {
            "description": "The ID used by YouVersion to uniquely identify this version",
            "type": "integer",
            "minimum": 1
          },
          "name": {
            "description": "The acronym for this version",
            "type": "string"
          }
        },
        "required": ["id", "name"],
        "additionalProperties": false
      }
    }
  },
  "required": ["books", "default_version", "versions"],
  "additionalProperties": false
}
