{
  "books": [
    {
      "id": "gen",
      "name": "उत्पत्ति"
    },
    {
      "id": "exo",
      "name": "निर्गमन"
    },
    {
      "id": "lev",
      "name": "लैव्यवस्था"
    },
    {
      "id": "num",
      "name": "गिनती"
    },
    {
      "id": "deu",
      "name": "व्यवस्थाविवरण"
    },
    {
      "id": "jos",
      "name": "यहोशू"
    },
    {
      "id": "jdg",
      "name": "न्यायियों"
    },
    {
      "id": "rut",
      "name": "रूत"
    },
    {
      "id": "1sa",
      "name": "1 शमूएल"
    },
    {
      "id": "2sa",
      "name": "2 शमूएल"
    },
    {
      "id": "1ki",
      "name": "1 राजा"
    },
    {
      "id": "2ki",
      "name": "2 राजा"
    },
    {
      "id": "1ch",
      "name": "1 इतिहास"
    },
    {
      "id": "2ch",
      "name": "2 इतिहास"
    },
    {
      "id": "ezr",
      "name": "एज्रा"
    },
    {
      "id": "neh",
      "name": "नहेमायाह"
    },
    {
      "id": "est",
      "name": "एस्तेर"
    },
    {
      "id": "job",
      "name": "अय्यूब"
    },
    {
      "id": "psa",
      "name": "भजन संहिता"
    },
    {
      "id": "pro",
      "name": "नीतिवचन"
    },
    {
      "id": "ecc",
      "name": "सभोपदेशक"
    },
    {
      "id": "sng",
      "name": "श्रेष्ठगीत"
    },
    {
      "id": "isa",
      "name": "यशायाह"
    },
    {
      "id": "jer",
      "name": "यिर्मयाह"
    },
    {
      "id": "lam",
      "name": "विलापगीत"
    },
    {
      "id": "ezk",
      "name": "यहेजकेल"
    },
    {
      "id": "dan",
      "name": "दानिय्येल"
    },
    {
      "id": "hos",
      "name": "होशे"
    },
    {
      "id": "jol",
      "name": "योएल"
    },
    {
      "id": "amo",
      "name": "आमोस"
    },
    {
      "id": "oba",
      "name": "ओबद्दाह"
    },
    {
      "id": "jon",
      "name": "योना"
    },
    {
      "id": "mic",
      "name": "मीका"
    },
    {
      "id": "nam",
      "name": "नहूम"
    },
    {
      "id": "hab",
      "name": "हबक्कूक"
    },
    {
      "id": "zep",
      "name": "सपन्याह"
    },
    {
      "id": "hag",
      "name": "हाग्गै"
    },
    {
      "id": "zec",
      "name": "जकर्याह"
    },
    {
      "id": "mal",
      "name": "मलाकी"
    },
    {
      "id": "mat",
      "name": "मत्ती"
    },
    {
      "id": "mrk",
      "name": "मरकुस"
    },
    {
      "id": "luk",
      "name": "लूका"
    },
    {
      "id": "jhn",
      "name": "यूहन्ना"
    },
    {
      "id": "act",
      "name": "प्रेरितों के काम"
    },
    {
      "id": "rom",
      "name": "रोमियो"
    },
    {
      "id": "1co",
      "name": "1 कुरिन्थियों"
    },
    {
      "id": "2co",
      "name": "2 कुरिन्थियों"
    },
    {
      "id": "gal",
      "name": "गलातियों"
    },
    {
      "id": "eph",
      "name": "इफिसियों"
    },
    {
      "id": "php",
      "name": "फिलिप्पियों"
    },
    {
      "id": "col",
      "name": "कुलुस्सियों"
    },
    {
      "id": "1th",
      "name": "1 थिस्सलुनीकियों"
    },
    {
      "id": "2th",
      "name": "2 थिस्सलुनीकियों"
    },
    {
      "id": "1ti",
      "name": "1 तीमुथियुस"
    },
    {
      "id": "2ti",
      "name": "2 तीमुथियुस"
    },
    {
      "id": "tit",
      "name": "तीतुस"
    },
    {
      "id": "phm",
      "name": "फिलेमोन"
    },
    {
      "id": "heb",
      "name": "इब्रानियों"
    },
    {
      "id": "jas",
      "name": "याकूब"
    },
    {
      "id": "1pe",
      "name": "1 पतरस"
    },
    {
      "id": "2pe",
      "name": "2 पतरस"
    },
    {
      "id": "1jn",
      "name": "1 यूहन्ना"
    },
    {
      "id": "2jn",
      "name": "2 यूहन्ना"
    },
    {
      "id": "3jn",
      "name": "3 यूहन्ना"
    },
    {
      "id": "jud",
      "name": "यहूदा"
    },
    {
      "id": "rev",
      "name": "प्रकाशित वाक्य"
    }
  ],
  "default_version": 819,
  "language": {
    "id": "hin",
    "name": "हिन्दी"
  },
  "versions": [
    {
      "full_name": "Hindi Holy Bible",
      "id": 819,
      "name": "HHBD"
    },
    {
      "full_name": "सरल हिन्दी बाइबल",
      "id": 1628,
      "name": "HSS"
    },
    {
      "full_name": "पवित्र बाइबिल CL Bible (BSI)",
      "id": 1682,
      "name": "HINCLBSI"
    },
    {
      "full_name": "पवित्र बाइबिल OV (Re-edited) Bible (BSI)",
      "id": 1683,
      "name": "HINOVBSI"
    },
    {
      "full_name": "नया नियम",
      "id": 1953,
      "name": "HIN2017"
    },
    {
      "full_name": "इंडियन रिवाइज्ड वर्जन (IRV) हिंदी - 2019",
      "id": 1980,
      "name": "IRVHIN"
    },
    {
      "full_name": "पवित्र बाइबल",
      "id": 2562,
      "name": "HERV"
    }
  ]
}
