{
  "books": [
    {
      "id": "gen",
      "name": "創世記"
    },
    {
      "id": "exo",
      "name": "出エジプト記"
    },
    {
      "id": "lev",
      "name": "レビ記"
    },
    {
      "id": "num",
      "name": "民数記"
    },
    {
      "id": "deu",
      "name": "申命記"
    },
    {
      "id": "jos",
      "name": "ヨシュア記"
    },
    {
      "id": "jdg",
      "name": "士師記"
    },
    {
      "id": "rut",
      "name": "ルツ記"
    },
    {
      "id": "1sa",
      "name": "サムエル記上"
    },
    {
      "id": "2sa",
      "name": "サムエル記下"
    },
    {
      "id": "1ki",
      "name": "列王紀上"
    },
    {
      "id": "2ki",
      "name": "列王紀下"
    },
    {
      "id": "1ch",
      "name": "歴代志上"
    },
    {
      "id": "2ch",
      "name": "歴代志下"
    },
    {
      "id": "ezr",
      "name": "エズラ記"
    },
    {
      "id": "neh",
      "name": "ネヘミヤ記"
    },
    {
      "id": "est",
      "name": "エステル記"
    },
    {
      "id": "job",
      "name": "ヨブ記"
    },
    {
      "id": "psa",
      "name": "詩篇"
    },
    {
      "id": "pro",
      "name": "箴言"
    },
    {
      "id": "ecc",
      "name": "伝道の書"
    },
    {
      "id": "sng",
      "name": "雅歌"
    },
    {
      "id": "isa",
      "name": "イザヤ書"
    },
    {
      "id": "jer",
      "name": "エレミヤ書"
    },
    {
      "id": "lam",
      "name": "哀歌"
    },
    {
      "id": "ezk",
      "name": "エゼキエル書"
    },
    {
      "id": "dan",
      "name": "ダニエル書"
    },
    {
      "id": "hos",
      "name": "ホセア書"
    },
    {
      "id": "jol",
      "name": "ヨエル書"
    },
    {
      "id": "amo",
      "name": "アモス書"
    },
    {
      "id": "oba",
      "name": "オバデヤ書"
    },
    {
      "id": "jon",
      "name": "ヨナ書"
    },
    {
      "id": "mic",
      "name": "ミカ書"
    },
    {
      "id": "nam",
      "name": "ナホム書"
    },
    {
      "id": "hab",
      "name": "ハバクク書"
    },
    {
      "id": "zep",
      "name": "ゼパニヤ書"
    },
    {
      "id": "hag",
      "name": "ハガイ書"
    },
    {
      "id": "zec",
      "name": "ゼカリヤ書"
    },
    {
      "id": "mal",
      "name": "マラキ書"
    },
    {
      "id": "mat",
      "name": "マタイによる福音書"
    },
    {
      "id": "mrk",
      "name": "マルコによる福音書"
    },
    {
      "id": "luk",
      "name": "ルカによる福音書"
    },
    {
      "id": "jhn",
      "name": "ヨハネによる福音書"
    },
    {
      "id": "act",
      "name": "使徒行伝"
    },
    {
      "id": "rom",
      "name": "ローマ人への手紙"
    },
    {
      "id": "1co",
      "name": "コリント人への第一の手紙"
    },
    {
      "id": "2co",
      "name": "コリント人への第二の手紙"
    },
    {
      "id": "gal",
      "name": "ガラテヤ人への手紙"
    },
    {
      "id": "eph",
      "name": "エペソ人への手紙"
    },
    {
      "id": "php",
      "name": "ピリピ人への手紙"
    },
    {
      "id": "col",
      "name": "コロサイ人への手紙"
    },
    {
      "id": "1th",
      "name": "テサロニケ人への第一の手紙"
    },
    {
      "id": "2th",
      "name": "テサロニケ人への第二の手紙"
    },
    {
      "id": "1ti",
      "name": "テモテヘの第一の手紙"
    },
    {
      "id": "2ti",
      "name": "テモテヘの第二の手紙"
    },
    {
      "id": "tit",
      "name": "テトスヘの手紙"
    },
    {
      "id": "phm",
      "name": "ピレモンヘの手紙"
    },
    {
      "id": "heb",
      "name": "ヘブル人への手紙"
    },
    {
      "id": "jas",
      "name": "ヤコブの手紙"
    },
    {
      "id": "1pe",
      "name": "ペテロの第一の手紙"
    },
    {
      "id": "2pe",
      "name": "ペテロの第二の手紙"
    },
    {
      "id": "1jn",
      "name": "ヨハネの第一の手紙"
    },
    {
      "id": "2jn",
      "name": "ヨハネの第二の手紙"
    },
    {
      "id": "3jn",
      "name": "ヨハネの第三の手紙"
    },
    {
      "id": "jud",
      "name": "ユダの手紙"
    },
    {
      "id": "rev",
      "name": "ヨハネの黙示録"
    }
  ],
  "default_version": 81,
  "language": {
    "id": "jpn",
    "name": "日本語"
  },
  "versions": [
    {
      "full_name": "Colloquial Japanese (1955)",
      "id": 81,
      "name": "JA1955"
    },
    {
      "full_name": "リビングバイブル",
      "id": 83,
      "name": "JCB"
    },
    {
      "full_name": "Seisho Shinkyoudoyaku 聖書 新共同訳",
      "id": 1819,
      "name": "新共同訳"
    },
    {
      "full_name": "Japanese: 聖書　口語訳",
      "id": 1820,
      "name": "口語訳"
    },
    {
      "full_name": "ALIVEバイブル: 新約聖書",
      "id": 2040,
      "name": "AB"
    }
  ]
}
