{
  "books": [
    {
      "id": "gen",
      "name": "I Mojżeszowa"
    },
    {
      "id": "exo",
      "name": "II Mojżeszowa"
    },
    {
      "id": "lev",
      "name": "III Mojżeszowa"
    },
    {
      "id": "num",
      "name": "IV Mojżeszowa"
    },
    {
      "id": "deu",
      "name": "V Mojżeszowa"
    },
    {
      "id": "jos",
      "name": "Jozuego"
    },
    {
      "id": "jdg",
      "name": "Sędziów"
    },
    {
      "id": "rut",
      "name": "Rut"
    },
    {
      "id": "1sa",
      "name": "1 Samuelowa"
    },
    {
      "id": "2sa",
      "name": "2 Samuelowa"
    },
    {
      "id": "1ki",
      "name": "1 Królewska"
    },
    {
      "id": "2ki",
      "name": "2 Królewska"
    },
    {
      "id": "1ch",
      "name": "1 Kronik"
    },
    {
      "id": "2ch",
      "name": "2 Kronik"
    },
    {
      "id": "ezr",
      "name": "Ezdrasza"
    },
    {
      "id": "neh",
      "name": "Nehemiasza"
    },
    {
      "id": "est",
      "name": "Estery"
    },
    {
      "id": "job",
      "name": "Joba"
    },
    {
      "id": "psa",
      "name": "Psalmy"
    },
    {
      "id": "pro",
      "name": "Przypowieści Salomonowych"
    },
    {
      "id": "ecc",
      "name": "Kaznodziei Salomonowego"
    },
    {
      "id": "sng",
      "name": "Pieśń nad Pieśniami"
    },
    {
      "id": "isa",
      "name": "Izajasza"
    },
    {
      "id": "jer",
      "name": "Jeremiasza"
    },
    {
      "id": "lam",
      "name": "Treny"
    },
    {
      "id": "ezk",
      "name": "Ezechiela"
    },
    {
      "id": "dan",
      "name": "Daniela"
    },
    {
      "id": "hos",
      "name": "Ozeasza"
    },
    {
      "id": "jol",
      "name": "Joela"
    },
    {
      "id": "amo",
      "name": "Amosa"
    },
    {
      "id": "oba",
      "name": "Abdiasza"
    },
    {
      "id": "jon",
      "name": "Jonasza"
    },
    {
      "id": "mic",
      "name": "Micheasza"
    },
    {
      "id": "nam",
      "name": "Nahuma"
    },
    {
      "id": "hab",
      "name": "Abakuka"
    },
    {
      "id": "zep",
      "name": "Sofoniasza"
    },
    {
      "id": "hag",
      "name": "Aggeusza"
    },
    {
      "id": "zec",
      "name": "Zachariasza"
    },
    {
      "id": "mal",
      "name": "Malachiasza"
    },
    {
      "id": "mat",
      "name": "Ewangelia Mateusza"
    },
    {
      "id": "mrk",
      "name": "Ewangelia Marka"
    },
    {
      "id": "luk",
      "name": "Ewangelia Łukasza"
    },
    {
      "id": "jhn",
      "name": "Ewangelia Jana"
    },
    {
      "id": "act",
      "name": "Dzieje Apostolskie"
    },
    {
      "id": "rom",
      "name": "Rzymian"
    },
    {
      "id": "1co",
      "name": "1 Koryntów"
    },
    {
      "id": "2co",
      "name": "2 Koryntów"
    },
    {
      "id": "gal",
      "name": "Galatów"
    },
    {
      "id": "eph",
      "name": "Efezów"
    },
    {
      "id": "php",
      "name": "Filipensów"
    },
    {
      "id": "col",
      "name": "Kolosensów"
    },
    {
      "id": "1th",
      "name": "1 Tesalonicensów"
    },
    {
      "id": "2th",
      "name": "2 Tesalonicensów"
    },
    {
      "id": "1ti",
      "name": "1 Tymoteusza"
    },
    {
      "id": "2ti",
      "name": "2 Tymoteusza"
    },
    {
      "id": "tit",
      "name": "Tytusa"
    },
    {
      "id": "phm",
      "name": "Filemona"
    },
    {
      "id": "heb",
      "name": "Żydów"
    },
    {
      "id": "jas",
      "name": "Jakuba"
    },
    {
      "id": "1pe",
      "name": "1 Piotra"
    },
    {
      "id": "2pe",
      "name": "2 Piotra"
    },
    {
      "id": "1jn",
      "name": "1 Jana"
    },
    {
      "id": "2jn",
      "name": "2 Jana"
    },
    {
      "id": "3jn",
      "name": "3 Jana"
    },
    {
      "id": "jud",
      "name": "Judy"
    },
    {
      "id": "rev",
      "name": "Objawienie św. Jana"
    }
  ],
  "default_version": 132,
  "language": {
    "id": "pol",
    "name": "Polski"
  },
  "versions": [
    {
      "full_name": "Biblia Gdańska",
      "id": 132,
      "name": "PBG"
    },
    {
      "full_name": "Słowo Życia",
      "id": 137,
      "name": "PLNT"
    },
    {
      "full_name": "UWSPÓŁCZEŚNIONA BIBLIA GDAŃSKA",
      "id": 138,
      "name": "UBG"
    },
    {
      "full_name": "Nowa Biblia Gdańska",
      "id": 319,
      "name": "NBG"
    },
    {
      "full_name": "Biblia, to jest Pismo Święte Starego i Nowego Przymierza Wydanie pierwsze 2018",
      "id": 2095,
      "name": "SNP"
    }
  ]
}
