{
  "books": [
    {
      "id": "gen",
      "name": "Mwanzo"
    },
    {
      "id": "exo",
      "name": "Kutoka"
    },
    {
      "id": "lev",
      "name": "Walawi"
    },
    {
      "id": "num",
      "name": "Hesabu"
    },
    {
      "id": "deu",
      "name": "Kumbukumbu la Sheria"
    },
    {
      "id": "jos",
      "name": "Yoshua"
    },
    {
      "id": "jdg",
      "name": "Waamuzi"
    },
    {
      "id": "rut",
      "name": "Ruthu"
    },
    {
      "id": "1sa",
      "name": "1 Samueli"
    },
    {
      "id": "2sa",
      "name": "2 Samueli"
    },
    {
      "id": "1ki",
      "name": "1 Wafalme"
    },
    {
      "id": "2ki",
      "name": "2 Wafalme"
    },
    {
      "id": "1ch",
      "name": "1 Mambo ya Nyakati"
    },
    {
      "id": "2ch",
      "name": "2 Mambo ya Nyakati"
    },
    {
      "id": "ezr",
      "name": "Ezra"
    },
    {
      "id": "neh",
      "name": "Nehemia"
    },
    {
      "id": "est",
      "name": "Esta"
    },
    {
      "id": "job",
      "name": "Yobu"
    },
    {
      "id": "psa",
      "name": "Zaburi"
    },
    {
      "id": "pro",
      "name": "Methali"
    },
    {
      "id": "ecc",
      "name": "Mhubiri"
    },
    {
      "id": "sng",
      "name": "Wimbo Ulio Bora"
    },
    {
      "id": "isa",
      "name": "Isaya"
    },
    {
      "id": "jer",
      "name": "Yeremia"
    },
    {
      "id": "lam",
      "name": "Maombolezo"
    },
    {
      "id": "ezk",
      "name": "Ezekieli"
    },
    {
      "id": "dan",
      "name": "Danieli"
    },
    {
      "id": "hos",
      "name": "Hosea"
    },
    {
      "id": "jol",
      "name": "Yoeli"
    },
    {
      "id": "amo",
      "name": "Amosi"
    },
    {
      "id": "oba",
      "name": "Obadia"
    },
    {
      "id": "jon",
      "name": "Yona"
    },
    {
      "id": "mic",
      "name": "Mika"
    },
    {
      "id": "nam",
      "name": "Nahumu"
    },
    {
      "id": "hab",
      "name": "Habakuki"
    },
    {
      "id": "zep",
      "name": "Sefania"
    },
    {
      "id": "hag",
      "name": "Hagai"
    },
    {
      "id": "zec",
      "name": "Zekaria"
    },
    {
      "id": "mal",
      "name": "Malaki"
    },
    {
      "id": "mat",
      "name": "Mathayo"
    },
    {
      "id": "mrk",
      "name": "Marko"
    },
    {
      "id": "luk",
      "name": "Luka"
    },
    {
      "id": "jhn",
      "name": "Yohane"
    },
    {
      "id": "act",
      "name": "Matendo"
    },
    {
      "id": "rom",
      "name": "Waroma"
    },
    {
      "id": "1co",
      "name": "1 Wakorintho"
    },
    {
      "id": "2co",
      "name": "2 Wakorintho"
    },
    {
      "id": "gal",
      "name": "Wagalatia"
    },
    {
      "id": "eph",
      "name": "Waefeso"
    },
    {
      "id": "php",
      "name": "Wafilipi"
    },
    {
      "id": "col",
      "name": "Wakolosai"
    },
    {
      "id": "1th",
      "name": "1 Wathesalonike"
    },
    {
      "id": "2th",
      "name": "2 Wathesalonike"
    },
    {
      "id": "1ti",
      "name": "1 Timotheo"
    },
    {
      "id": "2ti",
      "name": "2 Timotheo"
    },
    {
      "id": "tit",
      "name": "Tito"
    },
    {
      "id": "phm",
      "name": "Filemoni"
    },
    {
      "id": "heb",
      "name": "Waebrania"
    },
    {
      "id": "jas",
      "name": "Yakobo"
    },
    {
      "id": "1pe",
      "name": "1 Petro"
    },
    {
      "id": "2pe",
      "name": "2 Petro"
    },
    {
      "id": "1jn",
      "name": "1 Yohane"
    },
    {
      "id": "2jn",
      "name": "2 Yohane"
    },
    {
      "id": "3jn",
      "name": "3 Yohane"
    },
    {
      "id": "jud",
      "name": "Yuda"
    },
    {
      "id": "rev",
      "name": "Ufunuo"
    }
  ],
  "default_version": 74,
  "language": {
    "id": "swh",
    "name": "Kiswahili"
  },
  "versions": [
    {
      "full_name": "Biblia Habari Njema",
      "id": 74,
      "name": "BHN"
    },
    {
      "full_name": "Maandiko Matakatifu ya Mungu Yaitwayo Biblia",
      "id": 164,
      "name": "SUV"
    },
    {
      "full_name": "Biblia Habari Njema",
      "id": 393,
      "name": "BHND"
    },
    {
      "full_name": "Neno: Bibilia Takatifu 2014",
      "id": 1627,
      "name": "NEN"
    },
    {
      "full_name": "Swahili Revised Union Version",
      "id": 1817,
      "name": "SRUVDC"
    },
    {
      "full_name": "Swahili Revised Union Version",
      "id": 1818,
      "name": "SRUV"
    },
    {
      "full_name": "Biblia Habari Njema: Toleo la Kujifunza",
      "id": 2144,
      "name": "BHNTLK"
    },
    {
      "full_name": "Agano Jipya: Tafsiri ya Kusoma-Kwa-Urahisi",
      "id": 2484,
      "name": "TKU"
    },
    {
      "full_name": "Neno: Maandiko Matakatifu",
      "id": 2729,
      "name": "NMM"
    },
    {
      "full_name": "BIBLIA Yenye Vitabu vya Deuterokanoni HABARI NJEMA",
      "id": 2936,
      "name": "SCLDC10"
    },
    {
      "full_name": "BIBLIA KISWAHILI",
      "id": 2937,
      "name": "RSUVDC"
    },
    {
      "full_name": "New Testament in Swahili (Zanzibar) Revised Edition 1921",
      "id": 3048,
      "name": "SWZZB1921"
    },
    {
      "full_name": "Swahili Roehl Bible 1937",
      "id": 3049,
      "name": "SRB37"
    }
  ]
}
