{
  "books": [
    {
      "id": "gen",
      "name": "GÉNESIS"
    },
    {
      "id": "exo",
      "name": "ÉXODO"
    },
    {
      "id": "lev",
      "name": "LEVÍTICO"
    },
    {
      "id": "num",
      "name": "NÚMEROS"
    },
    {
      "id": "deu",
      "name": "DEUTERONOMIO"
    },
    {
      "id": "jos",
      "name": "JOSUÉ"
    },
    {
      "id": "jdg",
      "name": "JUECES"
    },
    {
      "id": "rut",
      "name": "RUT"
    },
    {
      "id": "1sa",
      "name": "1 SAMUEL"
    },
    {
      "id": "2sa",
      "name": "2 SAMUEL"
    },
    {
      "id": "1ki",
      "name": "1 REYES"
    },
    {
      "id": "2ki",
      "name": "2 REYES"
    },
    {
      "id": "1ch",
      "name": "1 CRÓNICAS"
    },
    {
      "id": "2ch",
      "name": "2 CRÓNICAS"
    },
    {
      "id": "ezr",
      "name": "ESDRAS"
    },
    {
      "id": "neh",
      "name": "NEHEMÍAS"
    },
    {
      "id": "est",
      "name": "ESTER"
    },
    {
      "id": "job",
      "name": "JOB"
    },
    {
      "id": "psa",
      "name": "SALMOS"
    },
    {
      "id": "pro",
      "name": "PROVERBIOS"
    },
    {
      "id": "ecc",
      "name": "ECLESIASTÉS"
    },
    {
      "id": "sng",
      "name": "CANTARES"
    },
    {
      "id": "isa",
      "name": "ISAÍAS"
    },
    {
      "id": "jer",
      "name": "JEREMÍAS"
    },
    {
      "id": "lam",
      "name": "LAMENTACIONES"
    },
    {
      "id": "ezk",
      "name": "EZEQUIEL"
    },
    {
      "id": "dan",
      "name": "DANIEL"
    },
    {
      "id": "hos",
      "name": "OSEAS"
    },
    {
      "id": "jol",
      "name": "JOEL"
    },
    {
      "id": "amo",
      "name": "AMÓS"
    },
    {
      "id": "oba",
      "name": "ABDÍAS"
    },
    {
      "id": "jon",
      "name": "JONÁS"
    },
    {
      "id": "mic",
      "name": "MIQUEAS"
    },
    {
      "id": "nam",
      "name": "NAHÚM"
    },
    {
      "id": "hab",
      "name": "HABACUC"
    },
    {
      "id": "zep",
      "name": "SOFONÍAS"
    },
    {
      "id": "hag",
      "name": "HAGEO"
    },
    {
      "id": "zec",
      "name": "ZACARÍAS"
    },
    {
      "id": "mal",
      "name": "MALAQUÍAS"
    },
    {
      "id": "mat",
      "name": "MATEO"
    },
    {
      "id": "mrk",
      "name": "MARCOS"
    },
    {
      "id": "luk",
      "name": "LUCAS"
    },
    {
      "id": "jhn",
      "name": "JUAN"
    },
    {
      "id": "act",
      "name": "HECHOS"
    },
    {
      "id": "rom",
      "name": "ROMANOS"
    },
    {
      "id": "1co",
      "name": "1 CORINTIOS"
    },
    {
      "id": "2co",
      "name": "2 CORINTIOS"
    },
    {
      "id": "gal",
      "name": "GÁLATAS"
    },
    {
      "id": "eph",
      "name": "EFESIOS"
    },
    {
      "id": "php",
      "name": "FILIPENSES"
    },
    {
      "id": "col",
      "name": "COLOSENSES"
    },
    {
      "id": "1th",
      "name": "1 TESALONICENSES"
    },
    {
      "id": "2th",
      "name": "2 TESALONICENSES"
    },
    {
      "id": "1ti",
      "name": "1 TIMOTEO"
    },
    {
      "id": "2ti",
      "name": "2 TIMOTEO"
    },
    {
      "id": "tit",
      "name": "TITO"
    },
    {
      "id": "phm",
      "name": "FILEMÓN"
    },
    {
      "id": "heb",
      "name": "HEBREOS"
    },
    {
      "id": "jas",
      "name": "SANTIAGO"
    },
    {
      "id": "1pe",
      "name": "1 PEDRO"
    },
    {
      "id": "2pe",
      "name": "2 SAN PEDRO"
    },
    {
      "id": "1jn",
      "name": "1 JUAN"
    },
    {
      "id": "2jn",
      "name": "2 JUAN"
    },
    {
      "id": "3jn",
      "name": "3 JUAN"
    },
    {
      "id": "jud",
      "name": "JUDAS"
    },
    {
      "id": "rev",
      "name": "APOCALIPSIS"
    }
  ],
  "default_version": 53,
  "language": {
    "id": "spa_es",
    "name": "Español (España)"
  },
  "versions": [
    {
      "full_name": "Dios Habla Hoy Versión Española",
      "id": 53,
      "name": "DHHE"
    },
    {
      "full_name": "La Biblia de las Américas",
      "id": 89,
      "name": "LBLA"
    },
    {
      "full_name": "Reina-Valera Antigua",
      "id": 147,
      "name": "RVES"
    },
    {
      "full_name": "Biblia Reina Valera 1960",
      "id": 149,
      "name": "RVR1960"
    },
    {
      "full_name": "Biblia Reina Valera 1995",
      "id": 150,
      "name": "RVR95"
    },
    {
      "full_name": "La Palabra (versión española)",
      "id": 210,
      "name": "BLP"
    },
    {
      "full_name": "La Biblia, Traducción Interconfesional (versión española)",
      "id": 214,
      "name": "BTI"
    },
    {
      "full_name": "Dios Habla Hoy Con Deuterocanónicos Versión Española",
      "id": 442,
      "name": "DHHED"
    },
    {
      "full_name": "Nueva Versión Internacional - Castellano",
      "id": 1637,
      "name": "NVI"
    },
    {
      "full_name": "Biblia del Oso 1573",
      "id": 1715,
      "name": "BDO1573"
    }
  ]
}
